api_name,api_code,description,latitude,longitude,weather,name,designation
Hopewell Furnace National Historic Site,hofu,"Hopewell Furnace showcases an early American landscape of industrial operations from 1771-1883, Hopewell and other iron plantations laid the foundation for the transformation of the United States into an industrial giant for the time. The park's 848 acres and historic structures illustrate the business, technology and lifestyle of our growing nation.",40.20610637,-75.76766355,"Summers are generally humid with daily temps. averaging 83 degrees (F) for a high and 60 degrees (F) for a low. Daily temps. in January average 38 degrees (F) for a high and 20 degrees (F) for a low. Precipitation averages 3-5 inches of rain per month during spring, summer and autumn. During winter conditions can be icy with snow accumulating up to several inches.",,National Historic Site
Horseshoe Bend National Military Park,hobe,"On March 27, 1814, Major General Andrew Jackson ‘s army of 3,300 men attacked Chief Menawa’s 1,000 Red Stick Creek warriors fortified in a horseshoe shaped bend of the Tallapoosa River. Over 800 Red Sticks died that day. This battle ended the Creek War, resulted in a land cession of 23,000,000 acres to the United States and created a national hero of Andrew Jackson.",32.97668879,-85.73413589,"Summers can be extremely hot and humid and winters can be damp, wet, and cold, with occasional hard freezes. During the summer season visitors should dress in light, comfortable clothing, wear comfortable shoes and use sunscreen and insect repellant. Stay hydrated to avoid risk of heat cramps, heat exhaustion and heatstroke. A bottle refill station is available in the visitor center. In the spring and fall visitors should have a light jacket available as temperatures can drop suddenly.",,National Military Park
Hot Springs National Park,hosp,"Hot Springs National Park has a rich cultural past. The grand architecture of our historic bathhouses is equally matched by the natural curiosities that have been drawing people here for hundreds of years. Ancient thermal springs, mountain views, incredible geology, forested hikes, and abundant creeks – all in the middle of town – make Hot Springs National Park a unique and beautiful destination.",34.52414366,-93.06332936,"Average temperatures in Hot Springs can range from about 90°F (32°C) to less than 27°F (-2.7°C). Summer days can be hot and humid, with heat index values up to 110ºF (43ºC). Winter wind chills can make temperatures feel much colder, as low as 15ºF (-9.4ºC). Spring and fall typically have the most rainfall. Generally, Hot Springs experiences mild weather throughout the year.",,National Park
Hovenweep National Monument,hove,"Hovenweep preserves six prehistoric sites built between A.D. 1200 and 1300 which may have served as ceremonial centers. Explore a variety of structures, including multistory towers perched on canyon rims and balanced on boulders. The construction and attention to detail will leave you marveling at the skill and motivation of the builders.",37.39134092,-109.0047977,"Hovenweep is part of the Colorado Plateau, a ""high desert"" region that experiences wide temperature fluctuations, sometimes over 40 degrees in a single day. The temperate (and most popular) seasons are spring (April-May) and fall (mid-September-October), when daytime highs average 60 to 80 F and lows average 30 to 50 F. Summer temperatures often exceed 100 F, making strenuous exercise difficult. Winters are cold, with highs averaging 30 to 50 F, and lows averaging 0 to 20 F.",,National Monument
Hubbell Trading Post National Historic Site,hutr,"Wóshdę́ę́, please come in where the squeaky wooden floors greet your entry into the oldest operating Trading Post on the Navajo Nation. As your eyes adjust to the dim light in the ""bullpen"", you'll find you've just entered a mercantile. Hubbell's in Ganado has been selling goods and trading Native American Art since 1878. Discover Hubbell Trading Post NHS, sheep, rugs, jewelry and so much more...",35.70727324,-109.5599515,Spring is normally windy. Summer can reach into high 90s with thunderstorms beginning in July into August. Fall is cooling off. Last couple of Winters have been dry and with a couple of inches of snow.,,National Historic Site
Ice Age Floods National Geologic Trail,iafl,"At the end of the last Ice Age, 18,000 to 15,000 years ago, an ice dam in northern Idaho created Glacial Lake Missoula stretching 3,000 square miles around Missoula, Montana. The dam burst and released flood waters across Washington, down the Columbia River into Oregon before reaching the Pacific Ocean. The Ice Age Floods forever changed the lives and landscape of the Pacific Northwest.",46.5669309008,-118.992564971,"The National Geologic Trail is a collection of sites stretched across a four state area, the weather will vary from site to site. Please check the weather for your local region, or the region you'll be visiting, through their respective sites.",,National Geologic Trail
Ice Age National Scenic Trail,iatr,"The Ice Age National Scenic Trail spans 1,200 miles, traverses some of Wisconsin's finest geologic and glacial features, and passes through the ancestral lands of 15 Tribes. The Trail is built, managed and maintained by dedicated volunteers, Ice Age Trail Alliance, Wisconsin Department of Natural Resources, local partners, and the National Park Service.",43.9895697794,-89.5612021706,"Wisconsin has four distinct seasons. Summers are generally warm, while winters are cold, often bringing significant snowfall. Weather conditions can vary widely throughout the year and location on the trail. Prepare accordingly for each season when visiting the Ice Age National Scenic Trail.",,National Scenic Trail
Independence National Historical Park,inde,"The park represents the founding ideals of the nation, and preserves national and international symbols of freedom and democracy, including Independence Hall and the Liberty Bell. The Declaration of Independence and US Constitution were both debated and signed inside Independence Hall, a UNESCO World Heritage Site.",39.94746112,-75.14794157,"Summers are typically hot and muggy, fall and spring are generally mild, and winter is cold. Snowfall is highly variable, with some winters bringing only light snow and others bringing several major snowstorms, with the normal seasonal snowfall standing at 22.4 in (57 cm). Precipitation is generally spread throughout the year, with eight to twelve wet days per month.",,National Historical Park
Indiana Dunes National Park,indu,"Lake Michigan's might has influenced Indiana Dunes for millennia. Wind and waves have shaped the land, leaving a rich mosaic of habitats along these 15 miles of Indiana coast. Over 50 miles of trails lead through shifting sand dunes, quiet woodlands, sunny prairies and lush wetlands. Known for its striking plant and bird diversity, it's easy to find inspiration throughout the park’s 16,000 acres.",41.63765525,-87.09647445,"On average, the warmest month is July and the highest recorded temperature was 105F in 1934. The coolest month is January, with the lowest recorded temperature of -25F in 1985. June sees the most precipitation with an average rainfall of 4.66 Inches.",,National Park
Isle Royale National Park,isro,"Explore a rugged, isolated island far from our connected communities. Isle Royale offers adventures for backpackers, hikers, boaters, paddlers, and divers. Cross Lake Superior and make a commitment: Become a part of this island, and let it become a part of you. Find peace and refuge in island wilderness – because Isle Royale, in turn, finds refuge in us. Help Isle Royale stay wild.",48.01145819,-88.82780657,"Isle Royale National Park is a remote island wilderness in the middle of Lake Superior. Weather influences traveling to and from the island, as well as your trip once you arrive. For the most up-to-date weather information, call (906) 482-0984 or email isro_parkinfo@nps.gov prior to your trip.",,National Park
Iñupiat Heritage Center,inup,"On the rooftop of the world, the Iñupiat Heritage Center in Barrow, Alaska, tells the story of the Iñupiat people. They have thrived for thousands of years in one of the most extreme climates on Earth, hunting the bowhead, or ""Agviq."" In the 19th century, the quiet northern seas swarmed with commercial whalemen from New England, who also sought the bowhead for its valuable baleen and blubber.",71.29832445,-156.7535863,"Owing to its location 320 miles (515 km) north of the Arctic Circle, Barrow's climate is cold and dry, classified as a polar climate (Köppen ET). Winter weather can be extremely dangerous because of the combination of cold and wind, while summers are cool even at their warmest.",,
James A Garfield National Historic Site,jaga,"A front porch can serve many purposes. For some, it is a place to enjoy the breeze on a warm summer night. For others, a perch from which to keep eyes on what's happening in their neighborhood. In 1880, James Garfield used his front porch as a platform to greet thousands of well-wishers during his presidential campaign. Today, the porch serves as a gateway to the story of the Garfield family.",41.66486549,-81.35086557,"Winter tends to be cold with snow and ice from January - early March. Summers are comfortable, but can be humid and reach into the 90's. There is a 100 yard walk between the Visitor Center and Garfield home; visitors are advised to check weather conditions prior to their visit.",,National Historic Site
Jean Lafitte National Historical Park and Preserve,jela,"In Jean Lafitte's day, silver and gold filled a pirate's treasure chest, but today's treasures are people, places, and memories. Discover New Orleans’ rich cultural mix. Learn Cajun traditions from people who live them. Watch an alligator bask on a bayou’s bank. Walk in the footsteps of the men who fought at 1815’s Battle of New Orleans. Follow the link to discover the treasure of Jean Lafitte.",29.81739855,-90.1402241,"All of the temperatures listed are in degrees Fahrenheit. Note that relative humidity, especially in summer months, can reach 90%, so temperatures can feel 10-20 degrees hotter than the actual temperature. Spring (March, April, May): average high 77 and low 61. Summer (June, July, August): average high 89 and low 75. Fall (September, October, November): average high 78 and low 64. Winter (December, January, February): average high 64 and low 48.",,National Historical Park and Preserve
Jewel Cave National Monument,jeca,"Immerse yourself in one of the longest caves in the world. With over 220 miles of mapped and surveyed passages, this underground wilderness appeals to human curiosity. Its splendor is revealed through fragile formations and glimpses of brilliant color. Its maze of passages lures explorers, and its scientific wealth remains a mystery. This resource is truly a jewel in the National Park Service.",43.73102945,-103.829994,"Weather in the Black Hills varies significantly throughout the year and may be drastically different from the northern hills to the southern hills. The temperatures listed are for average lows to average highs in the location of Custer, South Dakota. Spring ~ Temp. Range of 29°F to 53°F / Summer ~ Temp. Range of 54°F to 80°F / Fall ~ Temp. Range of 33°F to 58°F / Winter ~ Temp. Range of 14°F to 37°F The yearly average rain is 19 in., with May being the wettest month. The yearly average snow is 48 in.",,National Monument
Jimmy Carter National Historical Park,jica,"Few U.S. Presidents have had such close ties with where they were born and raised. The rural southern culture of Plains, Georgia revolves around farming, church, and school, which had a large influence in molding the character and shaping the political policies of the 39th President of the United States.",32.03611,-84.3924,"When visiting Southwest Georgia during the summer, expect hot and humid weather with the potential for thunderstorms. Check the local forecast before planning any outdoor activities in the region and be prepared with appropriate clothing, sun protection, and hydration to ensure a comfortable and safe visit.",,National Historical Park
John Day Fossil Beds National Monument,joda,"Large rhino-like brontotheres roam a semitropical forest. Dog-sized, three-toed horses dart between the trees. The cat-like nimravid and bear dogs stalk their prey. The climate cools and forests alter to dryer grasslands. Saber tooth cats and camels get replaced by mountain lions and deer. Paleontologists learn more about the ancient animals and environment with every new fossil they discover.",44.62566508,-119.8811491,"Weather conditions at John Day Fossil Beds National Monument are highly variable in this semi-arid desert landscape. Summer highs can climb into the 110's. Winters tend to be fairly mild, with occassional snow and ice and lows occasionally dipping into the single digits.",,National Monument
John Fitzgerald Kennedy National Historic Site,jofi,"JFK’s parents never expected that their second son would grow up to be president. Yet in his birthplace home he learned values that inspired a life in public service. His mother, Rose Kennedy, recreated her family’s first home to share her memories of those early years with visitors. We commemorate not only his early life, but the ideas and principles he left behind.",42.34693694,-71.12323846,"Typical New England Weather: Warm, humid summers and cold winters. Any available outdoor programs take place rain or shine but may be modified or canceled due to high heat index.",,National Historic Site
John Muir National Historic Site,jomu,"John Muir’s life was a tapestry of roles—fruit rancher, family man, writer—each interwoven with his deep love for nature. As one of America’s most influential naturalists, Muir was more than just an observer of the wilderness; he was its fiercest advocate. His passion for the land drove him to protect the places he held dear, ensuring that future generations could experience their beauty.",37.9828422,-122.1326097,"The Mediterranean climate of Martinez features hot, dry summers with lower temperatures near 60º F and upper temperatures near 100º F. The heat gives way to cool, rainy winters with lows near 45º F and highs near 75º F. Fall and spring can bring rain and temperatures from 55-80º F. March to April: wet/dry, 60-80º F May to September: very dry, 60-100º+ F October to November: dry/wet, 55-80º F December to February: wet, 45-75º F",,National Historic Site
Johnstown Flood National Memorial,jofl,"The South Fork Dam failed on Friday, May 31, 1889, and unleashed 20,000,000 tons of water that devastated Johnstown, PA. The flood killed 2,209 people but it brought the nation and the world together to aid the ""Johnstown sufferers."" The story of the Johnstown Flood reminds us all, ""...that we must leave nothing undone for the preservation and protection of our brother men.""",40.34584534,-78.77448601,"Winters can be cold and severe. Spring can be seasonable and wet. Summer can be hot with potentials for thunderstorms. Fall can be seasonal, with cold temperatures into October and November.",,National Memorial
Joshua Tree National Park,jotr,"Two distinct desert ecosystems, the Mojave and the Colorado, come together in Joshua Tree National Park. A fascinating variety of plants and animals make their homes in a land sculpted by strong winds and occasional torrents of rain. Dark night skies, a rich cultural history, and surreal geologic features add to the wonder of this vast wilderness in southern California. Come explore for yourself!",33.91418525,-115.8398125,"Days are typically clear with less than 25% humidity. Temperatures are most comfortable in the spring and fall, with an average highs around 85°F (29°C) and average lows around 50°F (10°C) respectively. Winter brings cooler days, around 60°F (15°C), and freezing nights. It occasionally snows at higher elevations. Summers are hot, over 100°F (38°C) during the day and not cooling much below 75°F (24°C) at night.",,National Park
Juan Bautista de Anza National Historic Trail,juba,"The Juan Bautista de Anza National Historic Trail covers over 1200 miles through the homelands of 70+ Tribal communities. It follows the historic route of the 1775-76 Spanish colonizing expedition from Sonora, Mexico to San Francisco, CA. Whether urban or rural, the trail offers adventure, diverse cultural perspectives, and an opportunity to experience history.",33.8743390994,-117.224179857,"The 1,200-mile Anza Trail connects historic, cultural, and recreation sites from Nogales, AZ, to the San Francisco Bay Area. To learn more, visit http://www.nps.gov/juba. Each site along the Anza Trail is managed independently. Contact individual sites for hours, directions, and other details.",,National Historic Trail
Kalaupapa National Historical Park,kala,"When Hansen's disease (leprosy) was introduced to the Hawaiian Islands, King Kamehameha V banished all afflicted to the isolated Kalaupapa Peninsula on the north shore of Molokai. Since 1866, more than 8,000 people, mostly Hawaiians, have died at Kalaupapa. Once a prison, Kalaupapa is now a refuge for the few remaining residents who are cured but were forced to live their lives in isolation.",21.1731108,-156.9511609,"Hawaii enjoys warm temperatures year-round, although site conditions at the park can vary depending on weather and time of year. The rainy season is in the winter with the more hot and humid days in the summer. Trade winds are fairly constant and typically blow from the northeast. Daytime temperatures range from 65–75° F in the winter to 80-90°F in the summer. Nighttime temperatures are often in the 60-70°F range.",,National Historical Park
Kaloko-Honokōhau National Historical Park,kaho,"Along the western coastline of the Island of Hawaiʻi lies the hot, rugged lava of Kaloko-Honokōhau. This seemingly barren and harsh landscape does not appear to be suitable for human existence, and yet, long before written history, the Hawaiian people built a thriving settlement upon this ʻaʻā lava.",19.68083237,-156.0306932,"The weather in the park is typically hot and sunny, with temperatures in the upper 80's.",,National Historical Park
Katahdin Woods and Waters National Monument,kaww,"Spread across a wild landscape offering spectacular views of Katahdin, Katahdin Woods and Waters invites discovery of its rivers, streams, woods, flora, fauna, geology, and the night skies that have attracted humans for millennia.",45.9567565918,-68.7122879028,"Northern Maine experiences all four seasons. Summer temperatures range from 45-90F (7-30C). Fall temperatures range from 30-70F (-1-21C). Typically, the first frost is in mid-October and first snowfall begins in November and can continue through April with an average accumulation of 73 inches (185 cm). Winter temperatures range from 14-35F (-10 - 2C). Spring temperatures range from 30-70F (-1-21C).",,National Monument
Katmai National Park & Preserve,katm,"A landscape is alive underneath our feet, filled with creatures that remind us what it is to be wild. Katmai was established in 1918 to protect the volcanically devastated region surrounding Novarupta and the Valley of Ten Thousand Smokes. Today, Katmai National Park and Preserve also protects 9,000 years of human history and important habitat for salmon and thousands of brown bears.",58.62235668,-155.0126574,"Located between the stormy north Pacific Ocean and the even stormier Bering Sea, the Katmai region is often a battleground between weather systems. When you visit, be prepared to encounter all types of weather. On average, wet and cool conditions predominate in spring, summer, and fall. Winters are drier and colder.",,National Park & Preserve
Kenai Fjords National Park,kefj,"At the edge of the Kenai Peninsula lies a land where the ice age lingers. Nearly 40 glaciers flow from the Harding Icefield, Kenai Fjords' crowning feature. Wildlife thrives in icy waters and lush forests along the fjords once carved by the vast expanse of ice. Today, shrinking glaciers bear witness to the effects of our changing climate.",59.81804414,-150.106502,"The weather in Kenai Fjords is difficult to predict and can change rapidly. The area generally enjoys a relatively temperate maritime climate, primarily due to the influence of warmer ocean currents that flows through the Gulf of Alaska. Summer daytime temperatures range from the mid 40s°F to the low 70s°F. Overcast and cool rainy days are frequent. Winter temperatures can range from the low 30s°F to -20°F.",,National Park
Kenilworth Park & Aquatic Gardens,keaq,"Deep within Kenilworth lies an oasis, hidden behind trees and cattails. It's a place where beavers build their homes and turtles sleep on logs. Lotus blooms rise from the muck and lilies sit on the water. The wind dances with the dragonflies, rustling through the trees, carrying the song of the birds until it brushes across your face, fading to a whisper, saying ""come join.""",38.9128,-76.9434,"June-September expect warm and humid weather. Average high temperatures are in the 80s, though often in the low 90s. On humid days, showers and thunderstorms often build in the late afternoon. July and August are the warmest months. The coldest month is January, with average daytime highs in the low 40s and overnight lows in the upper 20s.",,
Kennesaw Mountain National Battlefield Park,kemo,"Kennesaw Mountain National Battlefield Park is a 2,965 acre National Battlefield that preserves a Civil War battleground of the Atlanta Campaign. Opposing forces maneuvered and fought here from June 19, 1864 until July 2, 1864. Although most famous as a Civil War battlefield, Kennesaw Mountain has a much richer story.",33.95370717,-84.59214186,"Before you start your trip to the mountain, check the local weather forecast to be sure that you will have a dry time. Though we are located north of Atlanta, we're still have the same hot summers and mild winters as our neighbors. The mountain top generally ranges 8-10 degrees cooler than at the base. In fall and winter, be prepared with a light weight jacket on hand. After planning your activities, check back to see what the weather will have in store for your day.",,National Battlefield Park
Keweenaw National Historical Park,kewe,"The stories of people and copper in the Keweenaw Peninsula have been intertwined for more than 7,000 years. Indigenous peoples made copper into tools and trade items. Investors and immigrants arrived in the 1800s in a great mineral rush, developing thriving industries and cosmopolitan communities. Though the mines have since closed, their mark is still visible on the land and people.",47.1792308,-88.52275344,"Summer: Keweenaw summers are usually mild, with average highs in the 70s, but can reach into the 80s and 90s. Nighttime temperatures are typically cool, but can also dip into the 40s or stay in the 70s. Summer months are dry, with occasional rain or severe thunderstorms. Winter: Again influenced by Lake Superior, winter temperatures are mild with highs in the 20s. Cold spells can occur with subzero temperatures. Lake effect snow is common, and 300 inches of snow can fall in a season.",,National Historical Park
Kings Mountain National Military Park,kimo,"Thomas Jefferson called it ""The turn of the tide of success."" The battle of Kings Mountain, fought October 7th, 1780, was an important American victory during the Revolutionary War. The battle was the first major patriot victory to occur after the British invasion of Charleston, SC in May 1780. The park preserves the site of this important battle.",35.13900723,-81.38978712,Temperatures for the area range from very hot and humid in the summer to cool and moderate in the winter.,,National Military Park
Klondike Gold Rush - Seattle Unit National Historical Park,klse,"Seattle flourished during and after the Klondike Gold Rush. Merchants supplied people from around the world passing through this port city on their way to a remarkable adventure in the Yukon Territory of Canada. Today, the park is your gateway to learn about the Klondike Gold Rush, explore the area's public lands, and engage with the local community.",47.5993663,-122.3319664,"Warm dry summers from mid-July through mid-Sept, all the rest of the year, mainly rainy and cool.",,National Historical Park
Klondike Gold Rush National Historical Park,klgo,"Headlines screamed ""Gold!"" The dream of a better life catapulted thousands of people to Alaska and the Yukon Territory. Their journey shaped them, and changed the people they encountered and the north forever. Today, the park remembers the trails, boomtowns, and stories of the Klondike Gold Rush.",59.61042373,-135.2618535,Skagway has a highly variable climate with frequent rain and high winds. Average temperatures May through September range from 47-60ºF. Average temperatures October through April range from 28-38ºF.,,National Historical Park
Knife River Indian Villages National Historic Site,knri,"Earthlodge people hunted bison and other game, but were in essence farmers living in villages along the Missouri and its tributaries. The site was a major Native American trade center for hundreds of years prior to becoming an important market place for fur traders after 1750.",47.3540219,-101.3860533,"Summers are warm and sunny with temperatures occasionally reaching 100 degrees F and frequent afternoon thunderstorms. Winters are invigorating, with extremely cold temperatures as low as -35 degrees F. High winds and sunny skies are common in winter. Snow is sporadic in the relatively dry climate, but blizzards are common.",,National Historic Site
