api_name,api_code,description,latitude,longitude,weather,name,designation
Abraham Lincoln Birthplace National Historical Park,abli,"For over a century people from around the world have come to rural Central Kentucky to honor the humble beginnings of our 16th president, Abraham Lincoln. His early life on Kentucky's frontier shaped his character and prepared him to lead the nation through Civil War. Visit our country's first memorial to Lincoln, built with donations from young and old, and the site of his childhood home.",37.5858662,-85.67330523,"There are four distinct seasons in Central Kentucky. However, temperature and weather conditions can vary widely within those seasons. Spring and Fall are generally pleasant with frequent rain showers. Summer is usually hot and humid. Winter is moderately cold with mixed precipitation.",,National Historical Park
Acadia National Park,acad,"Acadia National Park protects the natural beauty of the highest rocky headlands along the Atlantic coastline of the United States, an abundance of habitats, and a rich cultural heritage. At 4 million visits a year, it's one of the top 10 most-visited national parks in the United States. Visitors enjoy 27 miles of historic motor roads, 158 miles of hiking trails, and 45 miles of carriage roads.",44.409286,-68.247501,"Located on Mount Desert Island in Maine, Acadia experiences all four seasons. Summer temperatures range from 45-90F (7-30C). Fall temperatures range from 30-70F (-1-21C). Typically the first frost is in mid-October and first snowfall begins in November and can continue through April with an average accumulation of 73 inches (185 cm). Winter temperatures range from 14-35F (-10 - 2C). Spring temperatures range from 30-70F (-1-21C).",,National Park
Adams National Historical Park,adam,"From the sweet little farm at the foot of Penn’s Hill to the gentleman’s country estate at Peace field, Adams National Historical Park is the story of “heroes, statesmen, philosophers…and learned women” whose ideas and actions helped to transform thirteen disparate colonies into one united nation.",42.2553961,-71.01160356,"Be prepared for hot, humid weather during the summer months. The historic homes are not air conditioned. While the visitor center remains open all year, the historic homes are generally closed from approximately November 1 through April 30. Winters in New England often feature low temperatures and snowy/icy conditions. Please exercise caution when visiting the park. The Visitor Center may close during inclement weather.",,National Historical Park
African American Civil War Memorial,afam,"Over 200,000 African-American soldiers and sailors served in the U.S. Army and Navy during the Civil War. Their service helped to end the war and free over four million slaves. The African American Civil War Memorial honors their service and sacrifice.",38.9166,-77.026,Washington DC gets to see all four seasons. Humidity will make the temps feel hotter in summer and colder in winter. Spring (March - May) Temp: Average high is 65.5 degrees with a low of 46.5 degrees Summer (June - August) Temp: Average high is 86 degrees with a low of 68.5 degrees Fall (September - November) Temp: Average high is 68 degrees with a low of 51.5 degrees Winter (December - February) Temp: Average high is 45 degrees with a low of 30 degrees (Source: www.usclimatedata.com),,
African Burial Ground National Monument,afbg,The African Burial Ground is the oldest and largest known excavated burial ground in North America for both free and enslaved Africans. It serves to protect and honor the historic role that slavery played in shaping New York's development.,40.71452681,-74.00447358,http://forecast.weather.gov/MapClick.php?CityName=New+York&state=NY&site=OKX&lat=40.7198&lon=-73.993#.Vqj8OvkrJlZ,,National Monument
Agate Fossil Beds National Monument,agfo,"In the early 1900s, paleontologists unearthed the Age of Mammals when they found full skeletons of extinct Miocene mammals in the hills of Nebraska -- species previously only known through fragments. At the same time, an age of friendship began between rancher James Cook and Chief Red Cloud of the Lakota. These two unprecedented events are preserved and protected here... at Agate Fossil Beds.",42.42170419,-103.753886,"Summers can be very warm, high 90's to 100 with the frequent afternoon thunderstorms. Plan to hike early and come down from the higher points if storms threaten. Winter temperatures can dip as low as -20 with snow and wind. Heaviest snows can be expected in late Spring.",,National Monument
Ala Kahakai National Historic Trail,alka,"Established in 2000 to preserve, protect and interpret traditional Native Hawaiian culture and natural resources, Ala Kahakai National Historic Trail is a 175-mile corridor encompassing a network of culturally and historically significant trails. This ""trail by the sea"" traverses wahi pana (storied landscapes), ancient Hawaiian sites and over 200 ahupuaʻa (traditional land divisions).",19.144668109,-155.890734294,"Hawaiʻiʻs coast is generally sunny and hot. Be prepared with sun protection (hat, mineral-based sunscreen, sunglasses and long sleeves) and water (minimum 2 liters of water per person per day for short hikes). Before visiting the Trail, check weather forecasts and follow all warnings and advisories: - https://www.weather.gov/hfo/ - www.hawaiicounty.gov/active-alerts",,National Historic Trail
Alagnak Wild River,alag,"The headwaters of Alagnak Wild River lie within the rugged Aleutian Range of neighboring Katmai National Park and Preserve. Meandering west towards Bristol Bay and the Bering Sea, the Alagnak traverses the beautiful Alaska Peninsula, providing an unparalleled opportunity to experience the unique wilderness, wildlife, and cultural heritage of southwest Alaska.",59.05180188,-156.112002,"Located between the stormy north Pacific Ocean and the even stormier Bering Sea, the Alagnak Wild River is often a battleground between weather systems. When you visit, be prepared to encounter all types of weather.  On average, wet and cool conditions predominate in spring, summer, and fall. Winters are drier and colder.",,Wild River
Alaska Public Lands,anch,"Alaska’s parks, forests, and refuges are rich and varied. The Alaska Public Lands Information Centers help visitors and residents to have meaningful, safe, enjoyable experiences on public lands, and encourages them to sustain the natural and cultural resources of Alaska. These centers provide trip-planning, interpretation, and education for all ages.",61.2188,-149.894536,"Visitors center is located inside the Federal Building and weather conditions are seasonal conditions of the Anchorage area, outside the facility.",,
Alcatraz Island,alca,"Alcatraz reveals stories of American incarceration, justice, and our common humanity. This small island was once a fort, a military prison, and a maximum security federal penitentiary. In 1969, the Indians of All Tribes occupied Alcatraz for 19 months in the name of freedom and Native American civil rights. We invite you to explore Alcatraz's complex history and natural beauty.",37.82676234,-122.4230206,"The climate on Alcatraz is unpredictable and can change suddenly. Cold, foggy mornings may give way to sunny afternoons, which in turn can shift quickly back to more fog and blustery winds. The most pleasant weather usually occurs in spring and fall. Summers tend to be cool and foggy, winter is our rainy season. Temperatures on Alcatraz seldom rise above 75°F (24°C) or fall below 38°",,
Aleutian Islands World War II National Historic Area,aleu,"The remote Aleutian Islands, home to the Unangax̂ (Aleut) people for over 8,000 years, became a fiercely contested Pacific battleground in World War II. Some Unangax̂ were taken from their homelands as Japanese prisoners of war while the others were evacuated from the islands by the government. Both groups suffered greatly during the war, and some would never return to their villages.",53.9143,-166.5197,"The Aleutian Islands are known for unpredictable and stormy weather. Rain, fog, and wind are common. Dress warmly and carry rain gear even in summer. Summer temperatures range from 45 to 65 degrees F.",,National Historic Area
Alibates Flint Quarries National Monument,alfl,"13,000 years ago, Alibates was used by mammoth hunters as a source of flint for tools. The colorful flint has never lost its value or usefulness in the Texas Panhandle. Learn how important this site was to the survival, commerce, and culture of the people of the High Plains.",35.5819662,-101.6717008,"The Texas Panhandle experiences a wide variety of weather conditions throughout the year. Winters are cold and windy, and summers are hot and dry. It is usually a good idea to bring a jacket with you if you are planning on hiking to the quarries with a ranger because the mesa gets very windy, even in the summer.",,National Monument
Allegheny Portage Railroad National Historic Site,alpo,"The first railroad to cross the Allegheny Mountains, the Allegheny Portage Railroad was the final piece of the Pennsylvania Main Line Canal. ""The Portage"" opened in 1834, marking the first time that there was one, direct route between Philadelphia and Pittsburgh. All things to all people, it served merchants, passengers, slaves in pursuit of freedom, and soldiers from the Mexican War.",40.42977467,-78.57431622,"The park is located in Cambria County, PA, and is at the summit of the Allegheny Mountains. Therefore, the park often takes on winter extremes. If planning on traveling from a long distance, please contact the park beforehand to ensure that the facilities are open. Please consult weather forecasts to ensure conditions are safe to travel in. Spring, summer, and fall are generally uneventful, but severe thunderstorms can occur.",,National Historic Site
Amache National Historic Site,amch,"Amache, also known as the Granada Relocation Center, near Granada, Colorado was one of ten incarceration sites established by the War Relocation Authority during World War II to unjustly incarcerate Japanese Americans. Over 10,000 people, most American citizens, were incarcerated at Amache from 1942 to 1945.",38.04962,-102.32903,"The site is located in Colorado on the High Plains, an arid, windy, and sunny environment. Temperatures and conditions can be extreme in this region, with hot, arid summers that include occasional thunderstorms and tornadoes, as well as cold and snowy winters.",,National Historic Site
American Memorial Park,amme,"American Memorial Park honors the American and Marianas people who gave their lives during the Marianas Campaign of World War II. At the park, memorials stand in tribute to the courage and sacrifice of the US Servicemen and Chamorro and Carolinian civilians who were killed in the battles between the United States and Japan that took place on Saipan, Tinian, and the Philippine Sea in 1944.",15.21680033,145.7231096,"The temperature varies from 75°F to 88°F and is rarely below 73°F or above 90°F.The climate is tropical, hot and humid throughout the year, with a relatively cool and dry season from December to June, and a warmer and rainy season from July to November. The temperatures are stable throughout the year.",,Park
Amistad National Recreation Area,amis,"An oasis in the desert, Amistad National Recreation Area consists of the US portion of the International Amistad Reservoir. Amistad, a Spanish word meaning ""friendship,"" is known for excellent water-based recreation, camping, hiking, and rich cultural history dating back nearly 5,000 years. Amistad is also home to a wide variety of plant and animal life both above and below the water.",29.53539777,-101.075821,"Weather in Southwest Texas can change in a matter of minutes. It is best to check the local weather report. Amistad National Recreation Area usually has hot summers and mild winters. For more information, please visit the park's Current Conditions page at https://www.nps.gov/amis/planyourvisit/conditions.htm.",,National Recreation Area
Anacostia Park,anac,"Welcome to Anacostia Park, your neighborhood national park in the heart of Washington, DC! Enjoy exercise along the river trail or relax by the water, Anacostia Park is a breath of fresh air and a space to unwind amid a bustling city.",38.8782,-76.9703,Spring brings mild temperatures and a light breeze along with springtime flower blooms. Summer can be hot and humid. Fall cools down and changing of the seasons brings changing of the colors in leaves. Winter gets cold and temperatures may drop below freezing.,,Park
Andersonville National Historic Site,ande,"Nearly 13,000 men died on these grounds, a site that became infamous even before the Civil War ended. Their burial grounds became Andersonville National Cemetery, where veterans continue to be buried today. This place, where tens of thousands suffered captivity so others could be free, is also home to the National Prisoner of War Museum and serves as a memorial to all American prisoners of war.",32.19831758,-84.12988898,Summer temperatures reach highs in the 80s-90s and high humidity. Winter temperatures tend to be in the 40s and below. Snow can occur but is rare. Average annual precipitation is 46.24 inches and is fairly evenly distributed throughout the year. The National Prisoner of War Museum is maintained at a cool temperature to help preserve artifacts; dressing in layers is recommended.,,National Historic Site
Andrew Johnson National Historic Site,anjo,"Andrew Johnson's complex presidency (1865-69) illustrates the Constitution at work following the Civil War. As the President and Congress disagreed on Reconstruction methods, the Constitution served as their guide on balance of powers, vetoes, and impeachment. In the end, it evolved as a living document with pivotal amendments on freedom, citizenship, and voting rights - topics still vital today.",36.15624509,-82.83709021,"There are four distinct seasons in East Tennessee, but temperature and weather conditions can vary widely within those seasons. Spring and Fall are generally pleasant with frequent rain showers. Summer and Winter ranges can be extreme. The President's Homestead is not climate controlled and may be closed at times during excessive highs or lows in the summer and winter.",,National Historic Site
Aniakchak National Monument & Preserve,ania,"Given its remote location and challenging weather conditions, Aniakchak is one of the most wild and least visited places in the National Park System. This landscape is a vibrant reminder of Alaska's location in the volcanically active ""Ring of Fire,"" as it is home to an impressive six mile (10 km) wide, 2,500 ft (762 m) deep caldera formed during a massive volcanic eruption 3,500 years ago.",56.85317675,-157.5544362,"When you visit, be prepared to encounter all types of weather. On average, wet and cool conditions predominate in spring, summer, and fall. Strong winds can delay the departure and arrival of boats and floatplanes.",,National Monument & Preserve
Antietam National Battlefield,anti,"23,000 soldiers were killed, wounded or missing after twelve hours of savage combat on September 17, 1862. The Battle of Antietam ended the Confederate Army of Northern Virginia's first invasion into the North and led Abraham Lincoln to issue the preliminary Emancipation Proclamation.",39.46763452,-77.73828017,The weather is fairly mild. Summers can be very warm and humid and winters cold and snowy. We have four distinct seasons with the fall and spring being the best times to visit the battlefield.,,National Battlefield
Apostle Islands National Lakeshore,apis,"Apostle Islands National Lakeshore, located at the northern tip of Wisconsin's Bayfield Peninsula, features 21 stunning islands, a scenic 12-mile shoreline along Lake Superior, and is located within the ancestral homeland of the Ojibwe people. Established in 1970, the park showcases picturesque sea caves, sandy beaches, and the largest collection of lighthouses in the National Park system.",46.96240467,-90.66045665,"Lake Superior is renowned for its cold temperatures, rough seas, fog, and sudden squalls. Boaters and paddlers should monitor marine weather forecasts and be constantly alert to changing conditions. Average daytime high temperatures range from 60 degrees Fahrenheit in May, to the upper 80s in mid-summer, to the mid-60s in September. Average lows vary from 40 degrees in May, to the upper 50s in mid-summer, to 50 degrees in September. Average water temperatures in May and June are only in the 40s.",,National Lakeshore
Appalachian National Scenic Trail,appa,"The Appalachian Trail is a 2,190+ mile long public footpath that traverses the scenic, wooded, pastoral, wild, and culturally resonant lands of the Appalachian Mountains. Conceived in 1921, built by private citizens, and completed in 1937, today the trail is managed by the National Park Service, US Forest Service, Appalachian Trail Conservancy, numerous state agencies and thousands of volunteers.",40.41029575,-76.4337548,"It is your responsibility to be prepared for all weather conditions, including extreme and unexpected weather changes year-round. As the trail runs from Georgia to Maine there will be different weather conditions depending on your location. For weather along specific sections of the trail and at specific shelters, please refer to: http://www.atweather.org/",,National Scenic Trail
Appomattox Court House National Historical Park,apco,"On April 9, 1865, the surrender of the Army of Northern Virginia in the McLean House in the village of Appomattox Court House, Virginia signaled the effective end of the nation's largest war. Questions remained: could the nation reunite as one? How would emancipation be realized?",37.38022164,-78.79856982,"The park may close due to emergency weather conditions (typically snow or ice). For updated information about possible closure or altered hours due to weather, please call 434-352-8987 ext. 245.",,National Historical Park
Arches National Park,arch,"Discover a landscape of contrasting colors, land forms, and textures unlike any other. The park has over 2,000 natural stone arches, hundreds of soaring pinnacles, massive rock fins, and giant balanced rocks. This red-rock wonderland will amaze you with its formations, refresh you with its trails, and inspire you with its sunsets.",38.72261844,-109.5863666,"Arches is part of the Colorado Plateau, a ""high desert"" region that experiences wide temperature fluctuations, sometimes over 40 degrees in a single day. The temperate (and most popular) seasons are spring (April-May) and fall (mid-September-October), when daytime highs average 60 to 80 F and lows average 30 to 50 F. Summer temperatures often exceed 100 F, making strenuous exercise difficult. Winters are cold, with highs averaging 30 to 50 F, and lows averaging 0 to 20 F.",,National Park
Arkansas Post National Memorial,arpo,"Located at the confluence of two rivers, Arkansas Post has served as a gathering place for many cultures throughout human history - it represents cultural cooperation, conflict, synthesis, and diversity.",34.00389998,-91.30837178,"Arkansas shares the same climate classification as the rest of the southeastern United States: humid subtropical. This type of climate features relatively mild winters and hot, steamy summers.",,National Memorial
"Arlington House, The Robert E. Lee Memorial",arho,"Arlington House is the nation’s memorial to Robert E. Lee. It honors him for specific reasons, including his role in promoting peace and reunion after the Civil War. In a larger sense it exists as a place of study and contemplation of the meaning of some of the most difficult aspects of American history: military service; sacrifice; citizenship; duty; loyalty; slavery and freedom.",38.8822021484,-77.0734786987,"Summers at Arlington House are generally hot and humid, with daytime highs frequently above 90 degrees Fahrenheit and scattered afternoon thunderstorms. Please carry water while participating in physical activity and be prepared to take shelter from lightning. Winters at Arlington are generally cold, with nighttime lows frequently near freezing and occasional snowfall. Please be alert for snowplows and icy spots on roadways. Weather during spring and fall is generally moderate, but can change quickly.",,
Assateague Island National Seashore,asis,"Want to live on the edge? Visit a place recreated each day by ocean wind and waves. Life on Assateague Island has adapted to an existence on the move. Explore sandy beaches, salt marshes, maritime forests and coastal bays. Rest, relax, recreate and enjoy some time on the edge of the continent.",38.05593172,-75.24524611,"Spring: Often windy and cool with lows in the 40's and highs in the 60's. Summer: Hot and humid with lows in the 60's and highs in the 80's. Fall: Warm with lows in the 50's and highs in the 70's. Winter: Damp cold and often windy. Lows in the 20's, highs in the 40's.",,National Seashore
Aztec Ruins National Monument,azru,"Aztec Ruins has some of the best-preserved Chacoan structures of its kind. Learn more about the ancestral Pueblo people in the park's museum and explore the Aztec West great house to see exceptionally advanced architecture, original wooden beams, and a restored Great Kiva. Aztec Ruins is a deeply sacred place to many Indigenous peoples across the American Southwest. Please visit with respect.",36.83682216,-107.9999245,"Summer High temperatures range between 80°F and 99°F degrees with a few days over 100°F. Afternoon thunderstorms usually cool things down in late July and August. Fall Usually pleasant, with mild days and crisp nights. Winter Daytime temperatures range between 20°F and 50°F with cold nights that can reach 0°F. Snow is periodic, but accumulations are typically only 1-2 inches. Spring Weather is especially unpredictable: it can be windy, cold, and wet, or still, warm, and dry.",,National Monument
Badlands National Park,badl,"The rugged beauty of the Badlands draws visitors from around the world. These striking geologic deposits contain one of the world’s richest fossil beds. Ancient horses and rhinos once roamed here. The park’s 244,000 acres protect an expanse of mixed-grass prairie where bison, bighorn sheep, prairie dogs, and black-footed ferrets live today.",43.68584846,-102.482942,The Badlands weather is variable and unpredictable with temperature extremes ranging from 116° F to -40° F. Summers are hot and dry with occasional violent thunderstorms. Hailstorms and occasional tornadoes can descend on the Badlands with sudden fury. Winters are typically cold with 12 to 24 inches of total snowfall.,,National Park
Baltimore-Washington Parkway,bawa,"This 29-mile highway connects Baltimore, MD and Washington, D.C. The parkway has carried visitors to and from the capital city since 1954.",39.02604289,-76.85410921,"The Washington, D.C. area has a four-season Mid-Atlantic climate. Summertime is warm and humid, while winter can be cold and snowy. Spring: During these months of transition, the weather can alternate from warm, humid air coming from the south to cold, dry air coming from the northwest. Be prepared for changing conditions. Summer: The warmest months are June, July, and August, with average highs in the 80s (~31 ?) combined with high humidity. Temperatures often climb into the 90s (~34?).",,Parkway
Bandelier National Monument,band,"Bandelier National Monument protects over 33,000 acres of ruggedly beautiful canyon and mesa country. Petroglyphs, dwellings carved into the soft rock cliffs, and standing masonry walls pay tribute to the early days of a culture that still survives in the surrounding communities.",35.77898596,-106.3317124,"Spring daytime temperatures in the 70's can be followed by a snow storm with wet heavy snow and daytime temperatures in the 40's. Summers are dry with June usually being the hottest month of the year. Days in July, August and September often end with thunderstorms that can drop heavy localized rain and are often accompanied by lightning. Autumn weather is usually sunny with blue skies and warm (but not hot) days and cool nights. Winter average snowfall 25"". Snow and ice can close trails and roads.",,National Monument
Belmont-Paul Women's Equality National Monument,bepa,"Home to the National Woman's Party for more than 90 years, this was the epicenter of the struggle for women's rights. From this house in the shadow of the U.S. Capitol and Supreme Court, Alice Paul and the NWP developed innovative strategies and tactics to advocate for the Equal Rights Amendment and equality for women. President Barack Obama designated the national monument on April 12, 2016.",38.89231541,-77.00381882,Washington DC gets to see all four seasons. Humidity will make the temps feel hotter in summer and colder in winter. Spring (March - May) Temp: Average high is 65.5 degrees with a low of 46.5 degrees Summer (June - August) Temp: Average high is 86 degrees with a low of 68.5 degrees Fall (September - November) Temp: Average high is 68 degrees with a low of 51.5 degrees Winter (December - February) Temp: Average high is 45 degrees with a low of 30 degrees (Source: www.usclimatedata.com),,National Monument
