api_name,api_code,description,latitude,longitude,weather,name,designation
El Camino Real de Tierra Adentro National Historic Trail,elca,"Travel along El Camino Real de Tierra Adentro National Historic Trail to experience and learn from a complicated legacy of 300 years of conflict, cooperation, and cultural exchange between a variety of empires—European and non-European alike.",33.7990672546,-106.866386195,"Due to the length of El Camino Real de Tierra Adentro National Historic Trail, be sure to consult local weather sources for the region you'll be visiting. Check out the forecast with the National Weather Service and search for the area you'd like to visit: weather.gov",,National Historic Trail
El Camino Real de los Tejas National Historic Trail,elte,"Explore a diverse array of histories contained within El Camino Real de los Tejas’ 150-year life, including the Spanish struggle to missionize American Indian nations, the growth of cattle ranching in the Mexican period, and the movement for Texan independence and statehood.",30.0922964581,-97.3397666725,"Due to the length of El Camino de los Tejas National Historic Trail, be sure to consult local weather sources for the region you'll be visiting. Check out the forecast with the National Weather Service and search for the area you'd like to visit: www.weather.gov",,National Historic Trail
El Malpais National Monument,elma,"The richly diverse volcanic landscape of El Malpais (el-mal-pie-EES) offers solitude, recreation, and adventure. Explore incredible geologic features such as lava flows, cinder cones, lava tube caves, and sandstone bluffs. While some may see a desolate environment, people have been adapting to and living in this extraordinary terrain for generations. Come visit the land of frozen fire!",34.88422799,-107.9950948,"As a general rule, daily temperatures swing roughly 30 (F) from night lows to afternoon highs. Summer is sunny and hot with monsoon rain storms and an average high of 80 (F). Winter is cool, sunny, with potential snow storms and an average high of 45 (F). Spring and fall are generally dry with the occasional storm rain and/or snow storm. For more information on weather and current weather conditions visit https://www.nps.gov/elma/planyourvisit/weather.htm",,National Monument
El Morro National Monument,elmo,"Imagine the refreshment of finding water after days of dusty travel. A reliable waterhole hidden at the base of a sandstone bluff made El Morro (the headland) a popular campsite for hundreds of years. Here, ancestral Puebloans, Spanish, and American travelers carved over 2,000 signatures, dates, messages, and petroglyphs. Make El Morro National Monument a stopping point on your travels.",35.03895916,-108.3463984,"At an elevation of 7,219 feet (2200 meters) winters can be cold and snowy. Summers are warm with afternoon thunder showers from mid-July through mid-September. Trails can close unexpectedly due to severe weather. Average snowfall: 40 inches per year. Average precipitation (snowmelt and rain): 16 inches per year. Warmest month: July, with average highs of 84 degrees and lows of 52 degrees. Coldest months: December and January, with average lows of 14-15 degrees, and average highs of 44-45 degrees.",,National Monument
Eleanor Roosevelt National Historic Site,elro,"Visit the home of Eleanor Roosevelt. Here, Franklin and Eleanor entertained friends, the press, activists, and official state visitors in the relaxed atmosphere of Val-Kill. Explore the Roosevelt saga in the homes of Franklin and Eleanor Roosevelt, the exhibits at the nation’s first Presidential Library, and over a thousand acres of gardens and trails.",41.76208482,-73.89894026,"Spring: Temperatures usually range from 40°F to 70°F. Rain is not uncommon. Summer: Temperatures usually range from 70° F to 100° F. Humidity can be high throughout the summer months with periods of rain. Fall: Temperatures usually range from 40° F to 70° F. Peak leaf season is mid-October. Rain is not uncommon. Winter: Temperatures usually range from 30° F to 50°F. Ice, Freezing Rain and Snow are not uncommon.",,National Historic Site
Ellis Island Part of Statue of Liberty National Monument,elis,"Millions of Americans and people around the world have ancestors who came through Ellis Island. The Main Immigration Building was the epicenter of one of the greatest migrations in modern history. Today, Ellis Island is a memorial to all who pursued the American dream and have made this nation their adopted home.",40.69946,-74.0401,It is typically colder and more windy in New York Harbor than elsewhere in New York City. Winters are cold and damp. Spring and Fall can range from chilly to warm. Summers are warm to hot and humid.,,Part of Statue of Liberty National Monument
Emmett Till and Mamie Till-Mobley National Monument,till,"In 1955, 14-year-old Emmett Till traveled to Money, Mississippi, to visit relatives. He was kidnapped, tortured, and murdered after reportedly whistling at a white woman. His mother, Mamie Till-Mobley, insisted on an open-casket funeral near their hometown of Chicago. Her brave decision let the world see the racist violence inflicted upon her son and set the Civil Rights Movement into motion.",33.9711,-90.3698,"The Emmett Till and Mamie Till-Mobley National Monument has sites in Chicago, IL and Sumner and Glendora, MS. Check local weather conditions in each unit before you visit.",,National Monument
Eugene O'Neill National Historic Site,euon,"America's only Nobel Prize-winning playwright, Eugene O'Neill, chose Northern California as his sanctuary at the pinnacle of his writing career. Secluded from the outside world within the serene walls of his Tao House, O'Neill crafted his final and most memorable masterpieces: The Iceman Cometh, Long Day's Journey Into Night, and A Moon for the Misbegotten.",37.82604456,-122.0271566,"The Mediterranean climate of Danville features hot, dry summers with lower temperatures near 60º F and upper temperatures near 100º F. The heat gives way to cool, rainy winters with lows near 45º F and highs near 75º F. Fall and spring can bring rain and temperatures from 55-80º F.",,National Historic Site
Everglades National Park,ever,"Established in 1947 as the first national park created for its biodiversity, Everglades National Park protects 1.5 million acres of wetland, forest, and marine habitats and the native plants and animals that call it home. With several international designations, the park provides a major source of drinking water for local residents of South Florida and recreational opportunities for all.",25.37294225,-80.88200301,The climate in Florida is known to be mild and sunny.The average annual temperatures for South Florida and the Keys range from 74° to 77°F (23° to 25°C). There are two seasons at the Everglades National Park: the wet season and the dry season. The wet season runs from Mid-May to November and the dry season runs from December to mid-May.,,National Park
Federal Hall National Memorial,feha,"Here on Federal Hall, George Washington took the oath of office as our first President, and this site was home to the first Congress, Supreme Court, and Executive Branch offices. The current structure, a Customs House, later served as part of the US Sub-Treasury. Now, the building serves as a museum and memorial to our first President and the beginnings of the United States of America.",40.70731192,-74.01025636,http://forecast.weather.gov/MapClick.php?CityName=New+York&state=NY&site=OKX&lat=40.7198&lon=-73.993#.Vqj8OvkrJlZ,,National Memorial
Fire Island National Seashore,fiis,"Immerse yourself in an enchanting collage of coastal life and history. Rhythmic waves, high dunes, ancient maritime forests, historic landmarks and glimpses of wildlife, Fire Island has been a special place for diverse plants, animals and people for centuries. Far from the pressure of nearby big-city life, dynamic barrier island beaches offer solitude, camaraderie, and spiritual renewal.",40.69668638,-73.00013462,"Spring: Temperatures may range from high 30s to low 50s (F). Rain and sun are equally common. Summer: Temperatures usually range from 65 F to 90 F. Fall: Temperatures from 70 F in early autumn to 40 F later in the season may be expected. Winter: Temperatures in the 30s (F) are common, with below freezing temperatures possible.",,National Seashore
First Ladies National Historic Site,fila,"First Ladies National Historic Site consists of two properties in downtown Canton, Ohio - the home of First Lady Ida Saxton-McKinley and our Visitor Center. Come learn about how the position of First Lady has evolved over time to include a public role.",40.79689857,-81.37579869,The weather at First Ladies National Historic Site is typical of Northeastern Ohio: four distinct seasons. Spring's rain and warming temperatures bring new leaves on trees and blooming wildflowers. Summer temperatures range from 49 to 95 degrees F and can be humid. Fall temperatures can range from low 70s during the day to freezing during the night. Fallcolor peaks mid-October. Winter weather conditions can rapidly change. Temperatures vary from mid-30s to below zero.,,National Historic Site
First State National Historical Park,frst,"Famous as the First State to ratify the Constitution, Delaware was born out of a conflict among three world powers for dominance of the Delaware Valley. From this beginning, the region developed a distinct character that tolerated diversity in religion and national origin and valued independence.",39.83076929,-75.56353942,"For details and information, visit, http://www.nps.gov/frst/index.htm.",,National Historical Park
Flight 93 National Memorial,flni,"On Tuesday morning, September 11, 2001, the U.S. came under attack when four commercial airliners were hijacked and used to strike targets on the ground. Nearly 3,000 people tragically lost their lives. Because of the actions of the 40 passengers and crew aboard one of the planes, Flight 93, the attack on the U.S. Capitol was thwarted.",40.06061476,-78.89456905,"Fall-Winter Cooler weather starts in September with warm days and cool nights. The first snowfall of the season occurs by mid-October and extends through late March to mid-April. Daytime temperatures range in the mid-20s to 30s, with periodic warming in the 40s and 50s. The average annual snowfall is approximately 80 inches for Somerset County. Spring-Summer May is more predictable for warmer weather with daytime temperatures in the 60s and 70s. July and August are also mild with highs in the 80s-90s",,National Memorial
Florissant Fossil Beds National Monument,flfo,"Beneath a grassy mountain valley in central Colorado lies one of the richest and most diverse fossil deposits in the world. Petrified redwood stumps up to 14 feet wide and thousands of detailed fossils of insects and plants reveal the story of a very different, prehistoric Colorado.",38.91260586,-105.2803396,Winter months - average high 40 degrees F; average low 5 degrees F; Summer months - average high 75 degrees F; average low 40 degrees F;,,National Monument
Ford's Theatre National Historic Site,foth,"On April 14, 1865, President Abraham Lincoln was assassinated at Ford’s Theatre. Discover how everyday people experienced a national tragedy and how we have remembered a fallen leader. Today, in partnership with Ford’s Theatre Society, live dramatic productions highlight Lincoln’s love of the theatre and the power of stories to connect us to ourselves and our history.",38.89668819,-77.02577944,Washington DC gets to see all four seasons. Humidity will make the temps feel hotter in summer and colder in winter. Spring (March - May) Temp: Average high is 65.5 degrees with a low of 46.5 degrees Summer (June - August) Temp: Average high is 86 degrees with a low of 68.5 degrees Fall (September - November) Temp: Average high is 68 degrees with a low of 51.5 degrees Winter (December - February) Temp: Average high is 45 degrees with a low of 30 degrees,,National Historic Site
Fort Bowie National Historic Site,fobo,"For nearly 25 years, Fort Bowie stood at the crossroads of the Chiricahua Apache's fight to defend their ancestral homeland and the U.S. Army's westward expansion. Today, visitors embark on a 3-mile scenic loop trail traversing the ground where this profound cultural collision forever altered the course of both American and Indigenous history.",32.14925942,-109.451132,,,National Historic Site
Fort Davis National Historic Site,foda,"Fort Davis is one of the best surviving examples of an Indian Wars' frontier military post in the Southwest. From 1854 to 1891, Fort Davis was strategically located to protect emigrants, mail coaches, and freight wagons on the Trans-Pecos portion of the San Antonio-El Paso Road and on the Chihuahua Trail.",30.59930381,-103.8961904,Summer Temperatures average a High of 95 and low of 65. Winter Temperatures average a High of 60 and a low of 20. Wind is very common and heavy rainfall is very sporadic.,,National Historic Site
Fort Donelson National Battlefield,fodo,"Brigadier General Ulysses S. Grant was becoming quite famous as he wrote these words following the surrender of Confederate Fort Donelson on Sunday, February 16, 1862. The Union victory at Fort Donelson elated the North, and stunned the South. Within days of the surrender, Clarksville and Nashville would fall into Union hands. Grant and his troops had created a pathway to victory for the Union.",36.49019078,-87.92445695,Fort Donelson National Battlefield traditionally experiences mild to moderate winters and hot summers with an average high of 90 degrees in the summer and 40 in winter; average lows in the winter are 30 degrees but single digits are not unusual. Rainfall in the area averages 53 inches a year with an additional 6 inches of ice/snow and violent thunderstorms can take place at any time of year.,,National Battlefield
Fort Dupont Park,fodu,"This 361 acre wooded park was once home to an earthen fort built to protect Washington, DC, during the Civil War. Today, visitors can see the fort's earthworks and escape to the great outdoors. Activities include picnics, nature walks, biking, gardening, environmental education, music, and ranger-led programs.",38.87731289,-76.94955824,"Open in all weather, unless otherwise noted under the alerts section of the parks website.",,
Fort Foote Park,fofo,"Fort Foote was constructed in 1863 atop Rozier's Bluff to strengthen the ring of fortifications that encircled Washington, D.C. Two of the Guns that protected Washington are still there along with the remains of the fort's earthworks.",38.76901785,-77.02812387,"Summers are generally hot and humid, with daytime highs frequently above 90 degrees Fahrenheit and scattered afternoon thunderstorms. Please carry water while participating in physical activity and be prepared to take shelter from lightning. Winters are generally cold, with nighttime lows frequently near freezing and occasional snowfall. Weather during spring and fall is generally moderate, but can change quickly.",,Park
Fort Frederica National Monument,fofr,"War was imminent as James Oglethorpe established Fort Frederica in 1736, to help protect the British colonies from the Spanish in Florida. Fort Frederica illustrates the story of the War of Jenkins Ear (1739-1748) and how its British defenders fought off the Spanish Army. Today, archeology has uncovered the story of the 1,000 people that once lived here.",31.2214699,-81.39452014,"The site enjoys mild climate from fall through early summer, followed by hot, humid summers.",,National Monument
Fort Laramie National Historic Site,fola,"Originally established as a private fur trading fort in 1834, Fort Laramie evolved into the largest and best-known military post on the Northern Plains before its abandonment in 1890. Nicknamed the “Grand Old Post,” Fort Laramie witnessed the entire sweeping saga of America’s western expansion and Indian resistance to encroachment on their territories.",42.20301694,-104.5459112,"Fort Laramie summer days can be quite hot (over 100F/37C), average highs are in the 80s and 90s (30-35C) with cool nights and low humidity. Winters are often bitterly cold and windy with subzero wind chills. The region is semi-arid with a distinct winter dry season. About 70% of annual precipitation falls as thunderstorms during the spring and early summer. Breezy days are common year-round and peak in the winter when wind speeds can approach hurricane-strength.",,National Historic Site
Fort Larned National Historic Site,fols,Discover a complete and authentic army post from the 1860s -1870s! This well-preserved fort on the Santa Fe Trail shares a tumultuous history of the Indian Wars era. The sandstone constructed buildings sheltered troops who were known as the Guardians of the Santa Fe Trail.,38.18047491,-99.21836664,"Central Kansas has a four-season climate. Winter tends to be cold and dry, with average daytime highs below 40F (4C). Foehn winds blowing across the Great Plains from the Southwest periodically raise temperatures above 80F (27C). Unsettled warmer air, higher winds, and severe weather arrive in the spring and often last through early July. Late summer days hover above 90F (32C) and readings over 100F (38C) are not uncommon. Fall is variable but generally milder with showers changing to snow and ice later.",,National Historic Site
Fort Matanzas National Monument,foma,"Fort Matanzas National Monument preserves the fortified coquina watchtower, completed in 1742, which defended the southern approach to the Spanish military settlement of St. Augustine. It also protects approximately 300 acres of Florida coastal environment containing dunes, marsh, maritime forest, and associated flora and fauna, including threatened and endangered species.",29.7121489,-81.23567535,"Summers are hot and humid with afternoon thundershowers. Sunscreen, a hat, UV protective sunglasses, and are recommended. Drink plenty of water. Winters are cool to mild with some cold spells, especially with wind from the north or off the water. Fall and spring are temperate with temperatures around 70F-80F (21C-26C). During danger of lightning, the fort will be closed and ferry service will be suspended. June-November is hurricane season so check for tropical storms before visiting.",,National Monument
Fort McHenry National Monument and Historic Shrine,fomc,"by the dawn's early light, a large red, white and blue banner? Whose broad stripes and bright stars... were so gallantly streaming...over Fort McHenry! The valiant defense of the fort during the Battle of Baltimore on September 13-14, 1814 inspired Francis Scott Key to write the words that became the U.S. national anthem. The fort's history holds many other stories too, from the Civil War to WWII.",39.26395314,-76.58044165,"Temperatures and weather in the spring and fall months tend to be mild. Ice, snow, and freezing temperatures can occur during winter. Extreme heat can occur during the summer months. Inclement weather may impact park hours of operation year round. Refer to the park alerts or call ahead to confirm operating hours.",,National Monument and Historic Shrine
Fort Monroe National Monument,fomr,"Fort Monroe's story spans from prehistory to the 2000s. Kecoughtan Indians occupied Old Point Comfort before the arrival of English colonists. The first enslaved Africans arrived in 1619. Those escaping slavery sought their freedom at the fort during the Civil War. The fort remained bastion of national defense until 2011, when it became a national park.",37.01733343,-76.30103195,"Spring: Temperatures range from 40 F to 70 F with rain being common. Summer: Temperatures range from 75 F to 100 F with rain and sun equally common. On very sunny days, be prepared with plenty of water. Fall: Temperatures usually range from 40 F to 65 F. Hurricanes are more likely to threaten the are at this time of year. If planning a visit during this time, please be mindful of the storm activity. Winter: Temperatures range from 40 F to 50 F on average with snow being uncommon.",,National Monument
Fort Necessity National Battlefield,fone,"The battle at Fort Necessity in the summer of 1754 was the opening action of the French and Indian War. This war was a clash of British, French and American Indian cultures. It ended with the removal of French power from North America. The stage was set for the American Revolution.",39.81306048,-79.59033344,"Weather varies considerably within each season. Be prepared with layered clothing. Precipitation is common throughout the year. Spring: Temperatures usually range from 25°F to 70°F. On average, May is the wettest month. Summer: Temperatures usually range from 50°F to 80°F. July is the warmest month. Fall: Temperatures usually range from 30°F to 70°F. Fall foliage is at its peak around mid-October. Winter: Temperatures range from 15°F to 40°F. January is the coldest month.",,National Battlefield
Fort Point National Historic Site,fopo,"From its vantage point overlooking the spectacular Golden Gate, Fort Point defended the San Francisco Bay following California's Gold Rush through World War II. Its beautifully arched casemates display the art of 3rd system brick masonry and interacts gracefully with the Golden Gate Bridge.",37.80837439,-122.473747,Fort Point is typically cold and windy throughout the year. Fog is especially common in the summer months. Come prepared with layers and windbreakers for maximum comfort.,,National Historic Site
Fort Pulaski National Monument,fopu,"For much of the 19th century, masonry fortifications were the United States’ main defense against overseas enemies. However, during the Civil War, new technology proved its superiority over these forts. Using rifled cannons, the U.S. Army compelled the Confederate garrison inside Fort Pulaski to surrender. The siege was a landmark experiment in the history of military science and invention.",32.0308274,-80.93361681,"Savannah has a humid sub tropical climate with over two hundred days of sunshine each year. Summers are typically hot, bright and humid with afternoon thunderstorms common. Temperatures often range from the lower 70s to the mid 90s F. Spring and autumn can be quite pleasant with temperatures ranging from the upper 50s into the 80s F. The winter months are usually dry. Temperatures can be cooler than one would expect, ranging from the upper 30s through the 60s F generally, though sudden cold snaps can occur.",,National Monument
Fort Raleigh National Historic Site,fora,"Amongst the shallow blue waters of the Outer Banks lies Fort Raleigh on Roanoke Island. Shaped by constant winds of change, Fort Raleigh has become a focal point of American history. From the first Algonquian-speaking people to the first English colonies, from formerly enslaved people starting anew to an inventor testing new radio technology, this island continues to be a place to forge new paths.",35.93278602,-75.71496865,Weather on the Outer Banks varies seasonally and daily. Please check the National Weather Service at http://www.weather.gov/mhx/ for up-to-date weather forecast information.,,National Historic Site
Fort Scott National Historic Site,fosc,"Promises made and broken! Who deserves to be free? The fight for freedom! Soldiers fighting settlers! Each of these stories is a link in the chain of events that encircled Fort Scott from 1842-1873. All of the site's structures, its parade ground, and its tallgrass prairie bear witness to this era when the country was forged from a young republic into a united transcontinental nation.",37.84358849,-94.70429174,"Spring and autumn are pleasant with mild temperatures. Summers are generally hot and humid, while winters are mild with periods of cold weather, snowfall, and ice storms. Thunderstorms, some severe, are common throughout the spring and summer. During periods of severe weather, visitors should seek shelter, as the area is prone to lightning strikes. Visitors are advised to check the weather prior to traveling.",,National Historic Site
Fort Smith National Historic Site,fosm,"Explore life on the edge of frontier and Indian Territory through the stories of soldiers, the Trail of Tears, scandals, outlaws, and lawmen who pursued them. From the establishment of the first Fort Smith on December 25, 1817, to the final days of Judge Isaac C. Parker's jurisdiction over Indian Territory in 1896, Fort Smith National Historic Site preserves almost 80 years of history.",35.38834746,-94.43129079,"Fort Smith weather includes four distinct, yet temperate seasons. Spring and fall are usually mild while late summer is hot and humid. During winter months, temperatures occasionally dip into the teens. Forecast often changes dramatically due to surrounding weather influences. Arkansas's central location allows weather systems from all directions to influence its climate. The area is prone to flash flooding and river flooding in rainy seasons.",,National Historic Site
Fort Stanwix National Monument,fost,"For centuries, the Oneida Carrying Place, a six-mile portage connecting the Mohawk River and Wood Creek, served as a vital link for those traveling by water from the ocean to the Great Lakes. When Europeans arrived, nations fought for control of the carry, the homelands of the Six Nations Confederacy, and the rich resources of North America. In this struggle, Fort Stanwix would play a vital role.",43.21053441,-75.45557626,"The Park lies within a temperate zone and experiences four full seasons. Summer can become very hot and humid. Snow is common as late as May and as early as October. The fort area can become muddy in all seasons. With most activities outdoors, good closed-toe walking shoes and low heels are advised. Air conditioning and heating is limited to park visitor center most times in the year. Water and extra layers of clothing in all seasons are always recommended!",,National Monument
