api_name,api_code,description,latitude,longitude,weather,name,designation
New River Gorge National Park & Preserve,neri,"A rugged, whitewater river flowing northward through deep canyons, the New River is among the oldest rivers on the continent. The park encompasses over 70,000 acres of land along the New River, is rich in cultural and natural history, and offers an abundance of scenic and recreational opportunities.",37.86878554,-80.99956002,"Weather in the Appalachian Mountains can be unpredictable and can change quickly. Always be prepared for the possibility of sudden storms. Weather in the mountains is often cooler and wetter than the surrounding area. On average, the warmest month is July. The maximum average precipitation also occurs in July.",,National Park & Preserve
Nez Perce National Historical Park,nepe,"Since time immemorial, the valleys, prairies, mountains, and plateaus of the inland northwest have been home to the nimíipuu (Nez Perce) people. Extremely resilient, they survived the settling of the United States and adapted to a changed world. Nez Perce National Historical Park consists of 38 places important to the history and culture of the nimíipuu. Explore these places. Learn their stories.",46.07019093,-115.8761258,"Elevations in the Park range from 700 feet above sea level to over 8,000, providing a wide range of climatic conditions, that follow the four seasons. Be prepared for very warm weather in the summer months, in particular in the river valleys. The spring and fall are moderate and comfortable. Winter conditions can be severe in the higher elevations, with snow and ice making travel difficult and dangerous. Please visit the National Weather Service for comprehensive weather information.",,National Historical Park
Nicodemus National Historic Site,nico,"Formerly enslaved African Americans left Kentucky at the end of the post-Civil War Reconstruction period to experience freedom in the ""Promised Land"" of Kansas. Nicodemus represents the involvement of African Americans in the homesteading movement across the Great Plains. It is the oldest and only remaining Black settlement west of the Mississippi River.",39.39167606,-99.61680329,"Northwest Kansas has a four-season climate typified by long, hot summers, cold winters, short spring and fall seasons, and a nearly constant breeze. Humidity is relatively low compared to the eastern portion of the state. Afternoon thunderstorms with lightning, hail, and gusty winds frequently occur during the spring and summer. Tornados are possible but are less common in Kansas than they are in several other states. Snow accumulation from winter blizzards occasionally causes site to close.",,National Historic Site
Ninety Six National Historic Site,nisi,Settlers struggled against the harsh backcountry to survive. Cherokee Indians hunted and fought to keep their land. Two towns and a trading post were formed then abandoned to the elements. And two Revolutionary War battles claimed over 100 lives. Come discover the 18th century history of South Carolina.,34.14273587,-82.01636079,Temperatures for the area range from very hot and humid in the summer to cool and moderate in the winter.,,National Historic Site
Niobrara National Scenic River,niob,"With a little something for everyone, the Niobrara National Scenic River is a destination for crossing adventures off your bucket list. Most popular for river recreation, you can float the Niobrara River on a canoe, tube, or kayak as a beginner and have a blast. Hiking, biking, and wildlife watching keep our visitors busy. Oh! And we haven't even told you about the waterfalls yet.",42.79413083,-99.91870646,"Summer (June-August): highs - low 80s to low 100s; lows - 50s to 60s, with occasional thunderstorms and associated strong winds. Moderate dry winds are common in the summer. 8.3"" is average summer rainfall. Winter (November-April): Average highs 20-30s, average lows 0-10s with 5.5""/month average snowfall. Spring (April/May) and Fall (September/October) have cooler temperatures: average highs 60-70s, average lows 30-40s with 7.3"" average rain/snowfall.",,National Scenic River
Noatak National Preserve,noat,"As one of North America's largest mountain-ringed river basins with an intact ecosystem, the Noatak River environs feature some of the Arctic's finest arrays of plants and animals. The river is classified as a National Wild and Scenic River. It offers stunning wilderness float-trip opportunities - from deep in the Brooks Range to the tidewater of the Chukchi Sea.",68.01027053,-159.831694,"Snow, rain, and freezing temperatures can occur any time of the year. Always travel with good quality rain gear and warm layers. Be especially careful to stay dry. Hypothermia can set in on a windy, wet day, even when it doesn't feel that cold.",,National Preserve
North Cascades National Park,noca,"Less than three hours from Seattle, an alpine landscape beckons. Discover communities of life adapted to moisture in the west and recurring fire in the east. Explore jagged peaks crowned by more than 300 glaciers. Listen to cascading waters in forested valleys. Witness a landscape sensitive to the Earth's changing climate. Help steward the ecological heart of the Cascades.",48.71171756,-121.2069423,The best weather for visiting the North Cascades generally occurs between mid-June and late-September. Summer daytime temperatures average in the 70's F. Snow is off most trails by mid-July. Autumn and Spring are popular for color and wildlife. Storms are common: always be prepared for a few days of rain and wind. The east side of the Cascade Mountains (Lake Chelan National Recreation Area) is drier and warmer in the summer than the west side. Summer temperatures at Stehekin reach the 90's F.,,National Park
North Country National Scenic Trail,noco,"Come to the North Country. Trek the hills and valleys. Stand on the shores of lakes & streams from glaciers 10,000 years before. Clear-flowing water, red/gold of autumn, a fairyland of snow, open prairies, and distant horizons paint the land. Historic sites along the way tell how America settled and grew as a nation. From North Dakota to Vermont, adventure is never far away.",46.334400743,-90.8165630499,"With the trail going through more than 4,800 miles through eight states from the Northeast to the Great Plains, weather along the trail can be highly variable. You could be subject to any kind of weather or temperature related emergency depending on your location and the season. Be careful to protect yourself from heat-related illnesses and hypothermia while out on the trail. Be mindful of lightning, severe storms, and other environmental hazards common to the “North Country.”",,National Scenic Trail
Obed Wild & Scenic River,obed,"The Obed Wild and Scenic River looks much the same today as it did when the first white settlers strolled its banks in the late 1700s. While meagerly populated due to poor farming soil, the river was a hospitable fishing and hunting area for trappers and pioneers. Today, the Obed stretches along the Cumberland Plateau and offers visitors a variety of outdoor recreational opportunities.",36.1056026037,-84.5979170501,"The weather along the Cumberland Plateau can be best described as unpredictable. Each season brings its own weather patterns. Summers are generally hot and humid, with high temperatures sometimes eclipsing 90 degrees. The low temperatures in winter often dip below freezing. Spring sees the most amount of precipitation, but rainfall can occur in various amounts throughout the year.",,Wild & Scenic River
Ocmulgee Mounds National Historical Park,ocmu,"Welcome to Ocmulgee Mounds National Historical Park. This park is a prehistoric American Indian site, where many different American Indian cultures occupied this land for thousands of years. American Indians first came here during the Paleo-Indian Period hunting Ice Age mammals. Around 900 CE, the Mississippian Period began, and people constructed mounds for their elite, which remain here today.",32.83816576,-83.60224853,Macon has a humid subtropical climate (Köppen climate classification Cfa). The average high temperature ranges from 46 to 58°F (7.7 to 14.4°C) in January and 82 to 91°F (27.7 to 32.7°C) in July. Winters are mild. Temps ranging from 30 degrees to 50 degrees. Spring is mild but wet. Temps ranging from 50 degrees to low 70 degrees. Summers are hot and very humid. Temp ranging from upper 80 degrees to 100 degrees. Fall is pleasant. Temps ranging from 60 to 80 degrees.,,National Historical Park
Oklahoma City National Memorial,okci,"The outdoor symbolic memorial is a place of quiet reflection, honoring victims, survivors, rescuers, and all who were changed forever on April 19, 1995. It encompasses the now sacred soil where the Alfred P. Murrah Federal Building once stood, capturing and preserving forever the place and events that changed the world.",35.473,-97.5171,"Summers are very warm with temperatures averaging mid-high 90’s. Also, be mindful of the heat index. Spring weather brings mild temperatures, 60’s-70’s, but the ability to produce severe storms that could include heavy rains, strong winds, hail, and tornadoes. While winters are generally mild delivering temperatures in the 30’s and 40’s, the wind chill can be brutal. No matter the season you are planning to visit, be prepared for the winds to be gusting.",,National Memorial
Old Spanish National Historic Trail,olsp,"Follow the routes of mule pack trains across the Southwest on the Old Spanish National Historic Trail between Santa Fe, New Mexico, and Los Angeles, California. New Mexican traders moved locally produced merchandise across what are now six states to exchange for mules and horses.",37.0791782514,-112.114693431,"Due to the length of Old Spanish National Historic Trail, be sure to consult local weather sources for the region you'll be visiting. Check out the forecast with the National Weather Service and search for the area you'd like to visit: weather.gov",,National Historic Trail
Olympic National Park,olym,"With its incredible range of precipitation and elevation, diversity is the hallmark of Olympic National Park. Encompassing nearly a million acres, the park protects a vast wilderness, thousands of years of human history, and several distinctly different ecosystems, including glacier-capped mountains, old-growth temperate rain forests, and over 70 miles of wild coastline. Come explore!",47.80392754,-123.6663848,"Summers tend to be fair and warm, with high temperatures between 65 and 75 degrees F. July, August and September are the driest months, with heavier precipitation during the rest of the year. While winters are mild at lower elevation, snowfall can be heavy in the mountains. It is common for different weather conditions to exist within the park at the same time. At any time of year, visitors should come prepared for a variety of conditions.",,National Park
Oregon Caves National Monument & Preserve,orca,"Deep within the Siskiyou Mountains are dark, twisting passages that await your discovery. Eons of acidic water seeping into marble rock created and decorated the wondrous “Marble Halls of Oregon.” Join a tour, get a taste of what caving is all about, and explore a mountain from the inside and out!",42.10319143,-123.4018586,For current weather conditions visit https://forecast.weather.gov/MapClick.php?lat=42.07376224008719&lon=-123.3984375&site=mfr&smap=1&unit=0&lg=en&FcstType=text#.YCGJRWhKjIV,,National Monument & Preserve
Oregon National Historic Trail,oreg,"Imagine yourself an emigrant headed for Oregon: would promises of lush farmlands and a new beginning lure you to leave home and walk for weeks? More than 2,000 miles of trail ruts and traces can still be seen along the Oregon National Historic Trail in six states and serve as reminders of the sacrifices, struggles, and triumphs of early American settlers.",41.9876977831,-109.634200841,"Due to the length of the Oregon National Historic Trail, be sure to consult local weather sources for the region you'll be visiting. Check out the forecast with the National Weather Service and search for the area you'd like to visit: weather.gov",,National Historic Trail
Organ Pipe Cactus National Monument,orpi,"Look closely. Look again. The sights and sounds of Organ Pipe Cactus National Monument, an International Biosphere Reserve, reveal a thriving community of plants and animals. Human stories echo throughout the Sonoran Desert, chronicling thousands of years of desert living. A wilderness hike, a scenic drive, or a night of camping will expose you to a living desert abounding with hidden life.",32.03585543,-112.8573314,"Summer months are hot, with temperatures exceeding 100F during the day and night-time temperatures in the high 70's. Winter months are milder, with temperatures in the 70s during the day and 30's to 40's in the evening.",,National Monument
Overmountain Victory National Historic Trail,ovvi,"Stretching 330-miles through four states (Virginia, Tennessee, North and South Carolina) the Overmountain Victory National Historic Trail traces the route used by Patriot militia during the pivotal Kings Mountain campaign of 1780. Follow their campaign by utilizing a Commemorative Motor Route along existing state highways marked with the distinctive trail logo, or 80+ miles of walkable trail.",35.14044,-81.377,Temperatures for the area range from very hot and humid in the summer to cool and moderate in the winter.,,National Historic Trail
Oxon Cove Park & Oxon Hill Farm,oxhi,"The diverse history of Maryland and our national heritage can be experienced at Oxon Cove Park. Through hands-on programs and other activities, you can experience farm life and how its changed over time. Explore how the park evolved from a plantation home during the War of 1812, to a hospital farm, to the park you can visit today.",38.80578214,-77.01131457,"Make sure that you wear appropriate shoes and clothing. Closed-toe shoes are recommended, sneakers or comfortable boots are best. Dress for the season, light clothes in summer, layers in spring and fall, and warm coats in winter. Cooler days are often the best days to visit Oxon Hill Farm if you’re interested in seeing farm animals or wildlife out and about. There are still lots of things to see and do on hotter days, just make sure to keep hydrated and take frequent breaks.",,
Ozark National Scenic Riverways,ozar,"Ozark National Scenic Riverways is the first national park area to protect a river system. The Current and Jacks Fork rivers are two of the finest floating rivers found anywhere. Spring-fed, cold and clear: they are a delight to canoe, swim, boat, or fish. Besides these two famous rivers, the park is home to hundreds of freshwater springs, caves, trails, and historic sites such as Alley Mill.",37.13968894,-91.25709817,"Ozark National Scenic Riverways is located in southeastern Missouri. Summer temperatures generally range from 75-100 degrees (°F) with high humidity. Winter temperatures generally range from 0-50 (°F) degrees with periods of intermittent freezing and snow. Periods of excessive heat are typical in summer, while heavy rains or flooding can occur throughout the year. Be sure to plan accordingly when camping, hiking, or floating.",,National Scenic Riverways
Padre Island National Seashore,pais,"Protecting sixty-six miles of wild coastline along the Gulf of America, the narrow barrier island is home to one of the last intact coastal prairie habitats in the United States. Along the hypersaline Laguna Madre, tidal mud flats teem with life. Native Americans, Spanish explorers and cattle ranchers have walked along its shores. Padre Island National Seashore is waiting to be rediscovered.",27.05381186,-97.35901135,"Padre Island has long, hot summers and short, mild winters. Summers are very humid. Winter can bring strong cold fronts and gale force winds. Most rain falls near the beginning and end of hurricane season (Jun 1 - Nov 30). Average seasonal temperatures (Fahrenheit): Spring - high 70s-80s, low 50s-60s; Summer - high mid-90s, low 70s; Fall - high 70s-80s, low 50s-60s; Winter - high 50s-70s, low 30s-40s. Year-round, average wind speed ranges from 5-25 miles per hour. Relative humidity seldom drops below 70%.",,National Seashore
Palo Alto Battlefield National Historical Park,paal,"On May 8, 1846, U.S. and Mexican troops clashed on the prairie of Palo Alto. The battle was the first in a two-year long war that changed the map of North America. Although the two countries have developed strong bonds and friendly ties since the war ended in 1848, these neighbors continue to contend with the legacy of the war.",26.02387351,-97.46296072,Summers are hot and humid. Tropical weather systems generally affect the area from August to October. Winters are usually mild but cold fronts can drop temperatures by up to 30 degrees in about an hour.,,National Historical Park
Paterson Great Falls National Historical Park,pagr,"Silk cloth and steam locomotives; textiles and continuous paper rolls; firearms and aircraft engines. What do these things have in common? All were manufactured in the same place - Paterson, NJ. In 1792, Paterson was established as America's first planned industrial city, centered around the Great Falls of the Passaic River. From humble mills rose industries that changed the face of the nation.",40.91584645,-74.18021494,http://forecast.weather.gov/MapClick.php?lat=40.91475800178142&lon=-74.1678490947591#.VusP4uIrK71,,National Historical Park
Pea Ridge National Military Park,peri,"On March 7-8, 1862, over 23,000 soldiers fought here to decide the fate of Missouri which was a turning point of the war in the Trans-Mississippi. This 4,400-acre battlefield honors those who fought and died on these hallowed grounds. Pea Ridge was the most pivotal Civil War battle west of the Mississippi River.",36.45438033,-94.03468357,"Pea Ridge National Military Park is located in the northwestern part of the state and is on a part of the Ozark Plateau. The climate is hot and humid in the summers, has mild temperatures in the fall, and drier and cooler temperatures in the winter. During the spring and summer, active thunderstorms can pop up. During the winter months, the wind chill factor can make the temperature feel much colder than the air temperature. The winters can be cold with some snow and ice.",,National Military Park
Pearl Harbor National Memorial,valr,"At Pearl Harbor National Memorial, we honor the lives affected by the December 7, 1941, attack. This pivotal moment in global history marked the United States' entry into World War II, impacting nations and communities worldwide. Join us in reflecting on this shared history and its lasting significance in the pursuit of peace.",21.3670699388,-157.938578898,"Hawaii has two seasons – winter (ho'oilo) and summer (kau wela) – and temperatures don't change drastically the way they do in the mainland United States. During the day, expect temperatures in the mid-70s to the mid-80s all year around. Expect lows in the winter months (November to March) to be around 60 degrees. The Hawaiian winter is also considered the rainy season, and flash floods are not uncommon. You can expect to see lots of rainbows as the rain clears.",,National Memorial
Pecos National Historical Park,peco,"Pecos is a natural and cultural crossroads through which hunters, gatherers, traders, missionaries, immigrants, soldiers, ranchers, and other travelers passed and lived. Follow in their footsteps and imagine Pecos through the centuries. Visit sites where cultural demonstrations and traditional practices continue today - a living legacy of the people who passed this way. At Pecos, past is present.",35.54192238,-105.6814684,"Pecos National Historical Park is located at nearly 7,000 feet in altitude in the high desert region of Northern New Mexico. Please know your limits at this high desert altitude. We recommend that you wear clothing appropriate to the season, bring plenty of water, stop for a snack or lunch at one of the picnic tables, wear comfortable shoes, and put on plenty of sunscreen. Specific daily Pecos weather information may be accessed at this link: http://www.nps.gov/peco/planyourvisit/weather.htm.",,National Historical Park
Pennsylvania Avenue,paav,"A street unlike any other. It is known the world over as the heart of the Nation's Capital. America's history has marched, paraded, promenaded, and protested its way along the Avenue.",38.89426856,-77.02506554,Washington DC gets to see all four seasons. Humidity will make the temps feel hotter in summer and colder in winter. Spring (March - May) Temp: Average high is 65.5 degrees with a low of 46.5 degrees Summer (June - August) Temp: Average high is 86 degrees with a low of 68.5 degrees Fall (September - November) Temp: Average high is 68 degrees with a low of 51.5 degrees Winter (December - February) Temp: Average high is 45 degrees with a low of 30 degrees (Source: www.usclimatedata.com),,
Perry's Victory & International Peace Memorial,pevi,"Perry's Victory and International Peace Memorial was established to honor those who fought in the Battle of Lake Erie, during the War of 1812, and to celebrate the long-lasting peace among Great Britain, Canada and the U.S. The Memorial, a Doric column, rising 352 feet over Lake Erie is situated 5 miles from the longest undefended border in the world.",41.65449782,-82.8115794,"Summer months can be extremely hot and humid, with occasional and sudden severe thunderstorms. Fall and spring are pleasant with cool temperatures but brisk winds can make a 60° day feel much colder. In winter the memorial and visitor center are closed.",,Memorial
Petersburg National Battlefield,pete,"Two hundred ninety-two days, eight offensives, over 70,000 casualties, U. S. Colored Troops, and the decline of Gen. Lee's Army of Northern Virginia all describe the Siege of Petersburg. U.S. forces cut off supplies to both Petersburg and the Confederate capital, Richmond. Today, the park preserves the sites of this pivotal campaign.",37.19109957,-77.47594865,Winters are usually cool with temperatures averaging in the 40s. Spring and fall are mild. Summer can bring very hot and humid weather.,,National Battlefield
Petrified Forest National Park,pefo,"Park Hours: 8am to 5pm, MST. Don't forget that Arizona does not observe Daylight Savings. Petrified Forest is best known for its Triassic fossils. It's like having two parks in one, an ecosystem over 200 million years old with plants and animals now represented in the surreal landscape of the Painted Desert. There is also a living park with its own denizens adapted to a demanding environment.",34.98387664,-109.7877678,Petrified Forest National Park is a semi-arid grassland. Temperatures range from above 100° F (38° C) to well below freezing. About 10 inches (25.4 cm) of moisture comes during infrequent snow in the winter and often dramatic summer thunder-storms. Animals and plants are adapted to extremes in temperature and moisture. You should be ready too. Check out the forecast before you arrive and plan accordingly.,,National Park
Petroglyph National Monument,petr,"Petroglyph National Monument protects one of the largest petroglyph sites in North America, featuring designs and symbols carved onto volcanic rocks by Native Americans and Spanish settlers 400 to 700 years ago. These images are a valuable record of cultural expression and hold profound spiritual significance for contemporary Native Americans and for the descendants of the early Spanish settlers.",35.13915998,-106.7491456,"Altitude approx. 5000 ft. Usually sunny and dry, with low relative humidity. Winter temperatures range from 40 to 50 degrees F. Summer temperatures range from 88-99 degrees F. 278 days of sunshine per year. Spring can be windy with 20 to 30 mph sustained winds which can produce periods of blowing sand and dust. For current weather forecast, Google Albuquerque weather.",,National Monument
Pictured Rocks National Lakeshore,piro,"Sandstone cliffs, beaches, waterfalls, sand dunes, inland lakes, deep forest, and wild shoreline beckon you to visit Pictured Rocks National Lakeshore. The power of Lake Superior shapes the park's coastal features and affects every ecosystem, creating a unique landscape to explore. Hiking, camping, sightseeing, and four-season outdoor opportunities abound.",46.56435642,-86.31628733,"Summers are pleasant with the average highs in June, July, and August in the 70s°F, and lows in the low 50s°F. The coldest months are December through March with average highs of 25°F to 32°F, and average lows in the teens. Annual precipitation averages 31 inches; average annual snowfall is about 140 inches, although winters with more than 200 inches are not uncommon. Snow generally covers the ground from late November through late April.",,National Lakeshore
Pinnacles National Park,pinn,"Around 23 million years ago, a series of volcanic eruptions shaped the landscape that is now Pinnacles National Park. The remnants of these ancient eruptions have formed a striking terrain of rocky spires and deep canyons. Visitors can explore diverse environments, from chaparral and oak woodlands to the cool, shaded depths of canyon floors.",36.49029208,-121.1813607,"Pinnacles National Park has a Mediterranean climate with hot, dry summers, and mild winters with moderate precipitation. The park is several miles inland from the Pacific Ocean. A wider variation in seasonal temperatures can be expected in the local area. Summers are hot with temperatures above 100 degrees. Winters are cooler with highs in the 60s. Big swings in temperature occur between day and night, year round.",,National Park
